{
  "templateId": "responder-com-arquivo",
  "templateVersion": 1,
  "name": "Responder com um arquivo do acervo",
  "description": "Um comando que responde sempre com o mesmo arquivo — cardápio em PDF, tabela de preços, áudio de boas-vindas, foto de produto. Você sobe o arquivo uma vez na aba Acervo, copia o identificador dele e cola aqui; o arquivo não é reenviado do seu celular a cada uso.",
  "category": "utilitarios",
  "dependsOn": [],
  "requiredCapabilities": [],
  "variables": [],
  "warnings": [
    {
      "level": "info",
      "text": "Suba o arquivo na aba Acervo ANTES de instalar: é lá que nasce o identificador que este comando pede. O botão \"Copiar id\" fica no cartão do arquivo."
    }
  ],
  "parameters": [
    {
      "key": "command",
      "label": "Comando",
      "type": "string",
      "default": "/cardapio",
      "help": "A palavra que a pessoa digita para receber o arquivo."
    },
    {
      "key": "allowFrom",
      "label": "Quem pode acionar",
      "type": "string",
      "default": "external",
      "help": "\"any\" responde também às SUAS próprias mensagens, do número onde o bot roda. \"external\" faz o bot ignorar o próprio número."
    },
    {
      "key": "fileId",
      "label": "Identificador do arquivo",
      "type": "string",
      "help": "Os 24 caracteres que aparecem no cartão do arquivo, na aba Acervo. Use o botão \"Copiar id\" lá."
    },
    {
      "key": "caption",
      "label": "Legenda",
      "type": "string",
      "default": "",
      "help": "Texto que acompanha o arquivo. Aceita variáveis — {{sender.name}} cumprimenta pelo nome. Arquivo de texto vira mensagem e não leva legenda."
    },
    {
      "key": "notFoundText",
      "label": "Se o arquivo sumiu",
      "type": "string",
      "default": "Esse arquivo não está mais disponível. Avise o dono do bot.",
      "help": "Enviado se o arquivo for apagado do acervo depois de o comando ser publicado — melhor avisar que ficar mudo."
    },
    {
      "key": "poolId",
      "label": "Pool que responde",
      "type": "string",
      "help": "Identificador do pool de números que vai executar este comando."
    }
  ],
  "documentTemplate": {
    "schemaVersion": 1,
    "enabled": true,
    "name": "Responder com um arquivo do acervo",
    "display": {
      "menuLabel": "{{params.command}}",
      "menuDescription": "Recebe um arquivo guardado no acervo"
    },
    "scope": {
      "include": [],
      "exclude": []
    },
    "inputPolicy": {
      "acceptedMessageKinds": [
        "text"
      ],
      "historyPolicy": "live_only"
    },
    "responder": {
      "strategy": "weighted_rendezvous",
      "poolId": "{{params.poolId}}"
    },
    "flow": {
      "nodes": [
        {
          "id": "gatilho-comando",
          "type": "trigger.command",
          "config": {
            "command": "{{params.command}}",
            "match": "exact",
            "allowFrom": "{{params.allowFrom}}"
          }
        },
        {
          "id": "enviar-arquivo",
          "type": "action.whatsapp.sendFile",
          "config": {
            "fileId": "{{params.fileId}}",
            "caption": "{{params.caption}}",
            "notFoundText": "{{params.notFoundText}}"
          }
        }
      ],
      "edges": [
        {
          "from": "gatilho-comando",
          "to": "enviar-arquivo",
          "on": "matched"
        }
      ]
    }
  }
}
