{
  "templateId": "auto-recover",
  "templateVersion": 1,
  "name": "Recuperar automaticamente",
  "description": "Recupera TODA visualização única que chegar, sem ninguém digitar comando. Instale escolhendo o destino \"conversas marcadas com auto_recover\" e ligue conversa por conversa pelo comando de configuração — assim ele vale só onde você quiser.",
  "category": "modulos-especializados",
  "dependsOn": [
    "config-auto-recover"
  ],
  "requiredCapabilities": [],
  "variables": [
    {
      "scope": "chat",
      "key": "auto_recover",
      "valueType": "text",
      "description": "Liga a recuperação automática NESTA conversa. Qualquer valor preenchido liga; vazio desliga. É o mesmo tipo de marcador do VIP."
    }
  ],
  "warnings": [
    {
      "level": "info",
      "text": "Instale escolhendo o destino \"conversas marcadas\" com o marcador auto_recover. Assim a regra fica desligada por padrão e só vale onde você ligar."
    },
    {
      "level": "info",
      "text": "Recupera sozinho, sem comando. Em grupo isso é visível para quem receber a mídia no destino configurado — pense onde ligar."
    }
  ],
  "parameters": [
    {
      "key": "caption",
      "label": "Legenda da mídia recuperada",
      "type": "string",
      "default": "👁 *VISUALIZAÇÃO ÚNICA CAPTURADA*\n\n👤 Nome: {{sender.name}}\n📱 Número: wa.me/{{sender.number}}\n🗂 Tipo: {{media.kind}}\n🕒 {{now.date}} {{now.time}}",
      "help": "Aceita as variáveis do sistema. {{media.kind}} diz se é foto, vídeo ou áudio."
    },
    {
      "key": "poolId",
      "label": "Pool que responde",
      "type": "string",
      "help": "Identificador do pool de números que vai executar este comando."
    }
  ],
  "documentTemplate": {
    "schemaVersion": 1,
    "enabled": true,
    "name": "Recuperar automaticamente",
    "display": {
      "menuLabel": null,
      "menuDescription": null
    },
    "scope": {
      "include": [],
      "exclude": []
    },
    "inputPolicy": {
      "acceptedMessageKinds": [
        "view_once"
      ],
      "historyPolicy": "live_only"
    },
    "responder": {
      "strategy": "weighted_rendezvous",
      "poolId": "{{params.poolId}}"
    },
    "flow": {
      "nodes": [
        {
          "id": "gatilho-visu",
          "type": "trigger.message",
          "config": {
            "allowFrom": "external",
            "messageKinds": [
              "view_once"
            ]
          }
        },
        {
          "id": "recuperar",
          "type": "action.whatsapp.recover",
          "config": {
            "destination": "fixed",
            "destinationId": "{{var.global.recover_destino}}",
            "caption": "{{params.caption}}"
          }
        }
      ],
      "edges": [
        {
          "from": "gatilho-visu",
          "to": "recuperar",
          "on": "matched"
        }
      ]
    }
  }
}
