{
  "templateId": "auto-download",
  "templateVersion": 1,
  "name": "Baixar links automaticamente",
  "description": "Baixa sozinho toda mídia de link que chegar, sem ninguém digitar comando. Instale escolhendo o destino \"conversas marcadas\" com o marcador auto_download, e ligue conversa por conversa pelo /autodow.",
  "category": "modulos-especializados",
  "dependsOn": [],
  "requiredCapabilities": [],
  "variables": [
    {
      "scope": "chat",
      "key": "auto_download",
      "valueType": "text",
      "description": "Liga o download automático NESTA conversa. Preenchido liga, vazio desliga — o mesmo tipo de marcador do VIP."
    }
  ],
  "warnings": [
    {
      "level": "info",
      "text": "Instale escolhendo o destino \"conversas marcadas\" com o marcador auto_download. Assim nasce desligado e vale só onde você ligar — um grupo movimentado baixaria tudo que passa."
    },
    {
      "level": "requirement",
      "text": "Precisa do serviço de download configurado no config.json."
    }
  ],
  "parameters": [
    {
      "key": "modo",
      "label": "O que baixar",
      "type": "string",
      "default": "auto",
      "help": "auto, video, audio ou thumbnail."
    },
    {
      "key": "ackText",
      "label": "Aviso ao começar",
      "type": "string",
      "default": "⏳ Baixando seu arquivo de mídia…",
      "help": "Marcando a mensagem do link."
    },
    {
      "key": "errorText",
      "label": "Se falhar",
      "type": "string",
      "default": "Não consegui baixar essa mídia: {{erro}}",
      "help": "{{erro}} vira o motivo."
    },
    {
      "key": "poolId",
      "label": "Pool que responde",
      "type": "string",
      "help": "Identificador do pool de números que vai executar este comando."
    }
  ],
  "documentTemplate": {
    "schemaVersion": 1,
    "enabled": true,
    "name": "Baixar links automaticamente",
    "scope": {
      "include": [],
      "exclude": []
    },
    "inputPolicy": {
      "acceptedMessageKinds": [
        "text"
      ],
      "historyPolicy": "live_only"
    },
    "responder": {
      "strategy": "weighted_rendezvous",
      "poolId": "{{params.poolId}}"
    },
    "flow": {
      "nodes": [
        {
          "id": "gatilho-link",
          "type": "trigger.message",
          "config": {
            "allowFrom": "external",
            "containsLink": true
          }
        },
        {
          "id": "baixar",
          "type": "action.media.download",
          "config": {
            "url": "{{message.link}}",
            "modo": "{{params.modo}}",
            "ackText": "{{params.ackText}}",
            "errorText": "{{params.errorText}}"
          }
        }
      ],
      "edges": [
        {
          "from": "gatilho-link",
          "to": "baixar",
          "on": "matched"
        }
      ]
    }
  }
}
