{
  "templateId": "x9",
  "templateVersion": 1,
  "name": "X9 — recuperar na mesma conversa",
  "description": "Irmão do /recover: responda uma mídia de visualização única e ela volta NA MESMA CONVERSA, à vista de todo mundo que está ali. O /recover manda para a conversa que você configurou; o /x9 entrega no lugar.",
  "category": "utilitarios",
  "dependsOn": [],
  "requiredCapabilities": [],
  "variables": [],
  "warnings": [
    {
      "level": "info",
      "text": "Reenvia NA CONVERSA onde o comando foi usado. Num grupo, todo mundo vê — é essa a intenção do comando. Se você quer receber em silêncio, use o /recover."
    },
    {
      "level": "info",
      "text": "Só funciona respondendo uma mídia de visualização única. O WhatsApp não entrega esse conteúdo direto ao bot: a cópia recuperável só existe dentro da mensagem respondida."
    }
  ],
  "parameters": [
    {
      "key": "command",
      "label": "Comando",
      "type": "string",
      "default": "/x9",
      "help": "A palavra que você digita respondendo a mídia de visualização única."
    },
    {
      "key": "allowFrom",
      "label": "Quem pode acionar",
      "type": "string",
      "default": "any",
      "help": "\"any\" responde também quando VOCÊ mandou a mídia do número onde o bot roda — é o normal para um comando pessoal. Use \"external\" se quiser que o bot ignore as próprias mensagens."
    },
    {
      "key": "caption",
      "label": "Legenda da mídia recuperada",
      "type": "string",
      "default": "👁 *VISUALIZAÇÃO ÚNICA CAPTURADA*\n\n👤 Nome: {{sender.name}}\n📱 Número: wa.me/{{sender.number}}\n🗂 Tipo: {{media.kind}}\n🕒 {{now.date}} {{now.time}}",
      "help": "Texto que acompanha a mídia reenviada. Aceita as variáveis do sistema — {{media.kind}} diz se é foto, vídeo ou áudio, e {{media.caption}} traz a legenda original (deixe de fora se a mídia costuma vir sem legenda: variável ausente aparece do jeito que está, e é assim de propósito, para o erro não passar batido)."
    },
    {
      "key": "notFoundText",
      "label": "Aviso quando não achar",
      "type": "string",
      "default": "Responda uma visualização única com este comando pra eu recuperar aqui mesmo.",
      "help": "Texto enviado quando o comando é usado sem responder uma visualização única."
    },
    {
      "key": "poolId",
      "label": "Pool que responde",
      "type": "string",
      "help": "Identificador do pool de números que vai executar este comando."
    }
  ],
  "documentTemplate": {
    "schemaVersion": 1,
    "enabled": true,
    "name": "X9 — recuperar na mesma conversa",
    "display": {
      "menuLabel": "{{params.command}}",
      "menuDescription": "Recupera visualização única na própria conversa"
    },
    "scope": {
      "include": [],
      "exclude": []
    },
    "inputPolicy": {
      "acceptedMessageKinds": [
        "text"
      ],
      "historyPolicy": "live_only"
    },
    "responder": {
      "strategy": "weighted_rendezvous",
      "poolId": "{{params.poolId}}"
    },
    "flow": {
      "nodes": [
        {
          "id": "gatilho-comando",
          "type": "trigger.command",
          "config": {
            "command": "{{params.command}}",
            "match": "exact_or_args",
            "allowFrom": "{{params.allowFrom}}"
          }
        },
        {
          "id": "recuperar",
          "type": "action.whatsapp.recover",
          "config": {
            "destination": "same_chat",
            "caption": "{{params.caption}}",
            "notFoundText": "{{params.notFoundText}}"
          }
        }
      ],
      "edges": [
        {
          "from": "gatilho-comando",
          "to": "recuperar",
          "on": "matched"
        }
      ]
    }
  }
}
