{
  "templateId": "ajuda",
  "templateVersion": 1,
  "name": "Ajuda (texto fixo)",
  "description": "Responde um comando com um texto de ajuda fixo, escrito por você. Serve como lista manual de comandos disponíveis até o menu dinâmico por grupo existir.",
  "category": "utilitarios",
  "dependsOn": [],
  "requiredCapabilities": [],
  "parameters": [
    {
      "key": "command",
      "label": "Comando",
      "type": "string",
      "default": "/ajuda",
      "help": "A palavra que a pessoa digita pra ver a ajuda."
    },
    {
      "key": "texto",
      "label": "Texto de ajuda",
      "type": "string",
      "default": "Comandos disponíveis: /ping",
      "help": "O texto exato que a automação responde."
    },
    {
      "key": "poolId",
      "label": "Pool que responde",
      "type": "string",
      "help": "Identificador do pool de números que vai responder este comando. Crie um pool na aba Automações antes de instalar, se ainda não tiver um."
    }
  ],
  "documentTemplate": {
    "schemaVersion": 1,
    "enabled": true,
    "name": "Ajuda (texto fixo)",
    "scope": { "include": [], "exclude": [] },
    "inputPolicy": { "acceptedMessageKinds": ["text"], "historyPolicy": "live_only" },
    "responder": { "strategy": "weighted_rendezvous", "poolId": "{{params.poolId}}" },
    "flow": {
      "nodes": [
        {
          "id": "gatilho-comando",
          "type": "trigger.command",
          "config": { "command": "{{params.command}}", "match": "exact", "allowFrom": "external" }
        },
        {
          "id": "resposta-whatsapp",
          "type": "action.whatsapp.reply",
          "config": { "text": "{{params.texto}}" }
        }
      ],
      "edges": [
        { "from": "gatilho-comando", "to": "resposta-whatsapp", "on": "matched" }
      ]
    }
  }
}
