{
  "templateId": "figurinha",
  "templateVersion": 1,
  "name": "Figurinha",
  "description": "Transforma uma imagem ou vídeo curto em figurinha do WhatsApp. A pessoa manda a mídia com o comando na legenda, ou responde uma mídia com o comando. Precisa do ffmpeg instalado na máquina que roda o número.",
  "category": "utilitarios",
  "dependsOn": [],
  "requiredCapabilities": [],
  "warnings": [
    {
      "level": "requirement",
      "text": "Exige o ffmpeg instalado na máquina que roda este número. Sem ele, o comando responde com erro em vez de gerar a figurinha."
    },
    {
      "level": "compatibility",
      "text": "Vídeos viram figurinha animada e são cortados nos primeiros segundos — é limite do próprio WhatsApp, não do sistema."
    }
  ],
  "parameters": [
    {
      "key": "command",
      "label": "Comando",
      "type": "string",
      "default": "/fig",
      "help": "A palavra que a pessoa digita pra transformar a mídia em figurinha."
    },
    {
      "key": "notFoundText",
      "label": "Aviso quando não vier mídia",
      "type": "string",
      "default": "Manda uma imagem ou vídeo curto junto com o comando pra eu virar figurinha.",
      "help": "Texto enviado quando o comando chega sem nenhuma imagem ou vídeo para converter."
    },
    {
      "key": "poolId",
      "label": "Pool que responde",
      "type": "string",
      "help": "Identificador do pool de números que vai responder este comando."
    }
  ],
  "documentTemplate": {
    "schemaVersion": 1,
    "enabled": true,
    "name": "Figurinha",
    "display": {
      "menuLabel": "{{params.command}}",
      "menuDescription": "Transforma imagem ou vídeo em figurinha"
    },
    "scope": {
      "include": [],
      "exclude": []
    },
    "inputPolicy": {
      "acceptedMessageKinds": [
        "text",
        "image",
        "video"
      ],
      "historyPolicy": "live_only"
    },
    "responder": {
      "strategy": "weighted_rendezvous",
      "poolId": "{{params.poolId}}"
    },
    "flow": {
      "nodes": [
        {
          "id": "gatilho-comando",
          "type": "trigger.command",
          "config": {
            "command": "{{params.command}}",
            "match": "exact_or_args",
            "allowFrom": "external"
          }
        },
        {
          "id": "gerar-figurinha",
          "type": "action.whatsapp.sticker",
          "config": {
            "notFoundText": "{{params.notFoundText}}"
          }
        }
      ],
      "edges": [
        {
          "from": "gatilho-comando",
          "to": "gerar-figurinha",
          "on": "matched"
        }
      ]
    }
  }
}
