{
  "templateId": "codigo-formatado",
  "templateVersion": 1,
  "name": "Responder com código colorido",
  "description": "Responde com o texto formatado como bloco de código com cores, em vez de texto simples. Útil para mandar trechos de código, tabelas ou fórmulas de forma legível.",
  "category": "utilitarios",
  "dependsOn": [],
  "requiredCapabilities": [],
  "warnings": [
    {
      "level": "unofficial",
      "text": "Este comando usa um caminho NÃO OFICIAL do WhatsApp. Não existe API de mensagem formatada para bots: para o aplicativo aceitar a formatação, a mensagem precisa viajar marcada como conteúdo da Meta AI. Como isso não é documentado, a Meta pode desativar a qualquer momento — e nesse dia o comando passa a responder em texto simples sozinho, sem quebrar."
    },
    {
      "level": "compatibility",
      "text": "Pode não aparecer formatado em versões antigas do aplicativo nem no WhatsApp Business. Nesses casos chega como texto comum."
    }
  ],
  "parameters": [
    {
      "key": "command",
      "label": "Comando",
      "type": "string",
      "default": "/codigo",
      "help": "A palavra que a pessoa digita, seguida do texto a formatar."
    },
    {
      "key": "language",
      "label": "Linguagem",
      "type": "string",
      "default": "javascript",
      "help": "Usada para colorir as palavras-chave. Exemplos: javascript, python, sql."
    },
    {
      "key": "poolId",
      "label": "Pool que responde",
      "type": "string",
      "help": "Identificador do pool de números que responde este comando."
    }
  ],
  "documentTemplate": {
    "schemaVersion": 1,
    "enabled": true,
    "name": "Responder com código colorido",
    "scope": {
      "include": [],
      "exclude": []
    },
    "inputPolicy": {
      "acceptedMessageKinds": [
        "text"
      ],
      "historyPolicy": "live_only"
    },
    "responder": {
      "strategy": "weighted_rendezvous",
      "poolId": "{{params.poolId}}"
    },
    "flow": {
      "nodes": [
        {
          "id": "gatilho-comando",
          "type": "trigger.command",
          "config": {
            "command": "{{params.command}}",
            "match": "exact_or_args",
            "allowFrom": "external"
          }
        },
        {
          "id": "responder-formatado",
          "type": "action.whatsapp.rich",
          "config": {
            "text": "{{message.args}}",
            "richKind": "code",
            "language": "{{params.language}}",
            "fallbackText": "{{message.args}}"
          }
        }
      ],
      "edges": [
        {
          "from": "gatilho-comando",
          "to": "responder-formatado",
          "on": "matched"
        }
      ]
    }
  }
}
